{"checks":{"both_interpretations_in_same_frozen_tuple":true,"graph_signatures_distinct":true,"padded_clipping_certificate_passed":true,"render_is_interpretation_independent":true,"same_tuple_full_gray_bytes_equal":true},"contract_binding":{"parent_contract_sha256":"55ddcaacdf851166554ccd586b2a924c0e793f86cc7a6319f98132ef0ffb6b65","parent_domain_cardinality":36088416,"v0_6_contract_sha256":"e326fc744903b998793746f299232c4225ce3b8648e1abdda7b4e065f06a9402"},"interpretations":[{"atom_count":4,"bond_count":2,"decode_kind":"graph_ambiguity","graph_signature":"{\"edges\":[[0,1,1],[2,3,1]],\"nodes\":[[\"C\",0],[\"C\",0],[\"C\",0],[\"C\",0]]}","graph_signature_sha256":"23d0d5ab828348cc9fb7e745b2a7ea41df32e42321251e12de0625ca74b8dce8","interpretation_index":0},{"atom_count":5,"bond_count":4,"decode_kind":"graph_ambiguity","graph_signature":"{\"edges\":[[0,1,1],[0,2,1],[0,3,1],[0,4,1]],\"nodes\":[[\"C\",0],[\"C\",0],[\"C\",0],[\"C\",0],[\"C\",0]]}","graph_signature_sha256":"5f509d1c762d5f9e8c0f1c51f6897575e7538d7552bd97db6470b93eddcc1eb8","interpretation_index":1}],"raster":{"byte_length":589824,"format":"gray8-768x768","sha256":"2042e8db2c343cf9c2308ab62fe97448761aab8418fb5dd4e1dc18be3f32fac2"},"schema_version":"chemgraph-constructive-witness-v0.6","scope":{"claim":"full_frozen_domain_contains_a_non_singleton_graph_fiber","full_domain_collision_rate_claimed":false,"neural_generalization_claimed":false,"production_png_equivalence_claimed":false,"sampled_to_full_extrapolation_used":false,"training_authorized":false},"status":"passed","witness_tuple":{"antialias_profile":"box_2x2","cap":"round","half_length":85,"motif_ordinal":25,"reflection":"none","rotation_index":0,"scale_index":3,"tuple_id":18037323,"width_px":5}}
